{
  "$schema":"https://json-schema.org/draft/2020-12/schema",
  "type":"object","additionalProperties":false,
  "required":["schema_version","engine","engine_version","feature_schema_version","rule_pack_sha256","matches","not_evaluated","warnings"],
  "properties":{"schema_version":{"const":"1.0.0"},"engine":{"type":"string"},"engine_version":{"type":"string"},"feature_schema_version":{"type":"string"},"rule_pack_sha256":{"type":"string","pattern":"^[0-9a-f]{64}$"},"matches":{"type":"array","maxItems":1024},"not_evaluated":{"type":"array","items":{"type":"string"}},"warnings":{"type":"array","items":{"type":"string"}}}
}
