{"schema_version":"1.0.0","engine":"pasol-rules","engine_version":"0.1.0","feature_schema_version":"1.0.0","rule_pack_sha256":"d4f5f4e848f9bcf2cae1f3299322f2a92d26bd077b8ec09593c7b08956b68388","matches":[{"rule_id":"pasol.pe.writable_executable_section","rule_version":1,"severity":"medium","confidence":"medium","title":"Writable and executable section","explanation":"The feature report contains a writable-and-executable section.","evidence":[{"path":"/metadata/sections","summary":"Writable and executable section count"}]}],"not_evaluated":[],"warnings":[]}
